Başlık,Yayın Tarihi,Görüntüleme,Beğeni,Yorum,Süre
İçinizden Geçen Parçacıkları Hissediyor musunuz?,2025-05-06T16:14:40Z,282203,11106,213,0:01:00
"Nükleer mi, Güneş mi: En İyi Enerji Kaynağı Hangisi?",2025-05-04T12:20:03Z,336358,16023,687,0:25:27
Uzayda Yaşam Bu Kez Bulundu mu?,2025-05-01T15:34:23Z,617711,24870,1023,0:24:56
Birden Fazla Evren Var Olabilir mi?,2025-04-29T16:32:54Z,387608,16027,242,0:00:59
"Ozempic Devrimi: Yeni Zayıflama İlaçları Mucize mi, Zehir mi?",2025-04-27T06:00:19Z,887341,37143,1754,0:27:20
Rüyalarınızı Cep Telefonunuza Kaydedebilir misiniz?,2025-04-26T07:09:08Z,1248292,47001,627,0:01:00
Kedi ve Köpeklerinize Ne Kadar Yaş Mama Vermelisiniz?,2025-04-25T13:30:36Z,177448,6806,100,0:00:49
"Sezaryenle Doğuran Anneler ""Anormal"" mi?",2025-04-24T15:30:30Z,385363,27424,2215,0:26:08
Sirke Aslında Nedir?,2025-04-22T15:30:07Z,1210259,43262,738,0:00:59
Varoluşsal Kriz: Neden Varsınız? Bu Hayattaki Amacınız Ne?,2025-04-17T17:24:41Z,468331,26822,2111,0:25:55
